{
  "$schema": "https://json-schema.org/draft/2020-12/schema",
  "$id": "full-text.schema.json",
  "title": "full-texts/{propositionId}.json",
  "description": "Text extracted from the inteiro teor PDF, without OCR (door 8)",
  "type": "object",
  "additionalProperties": false,
  "required": [
    "house",
    "propositionId",
    "sourceUrl",
    "documentSha256",
    "extractor",
    "extractedAt",
    "text"
  ],
  "properties": {
    "house": {
      "type": "string",
      "enum": [
        "camara",
        "senado"
      ],
      "description": "The chamber the record belongs to; part of every key (door 3)"
    },
    "propositionId": {
      "type": "integer",
      "minimum": 1
    },
    "sourceUrl": {
      "type": "string",
      "pattern": "^https?://",
      "description": "The URL the PDF was fetched from"
    },
    "documentSha256": {
      "type": "string",
      "pattern": "^[0-9a-f]{64}$"
    },
    "extractor": {
      "type": "string",
      "pattern": "^pypdf \\S+$"
    },
    "extractedAt": {
      "type": "string",
      "pattern": "^\\d{4}-\\d{2}-\\d{2}T\\d{2}:\\d{2}:\\d{2}Z$"
    },
    "text": {
      "type": "string"
    }
  }
}
